{
  "manifest_version": "4.0",
  "schema_version": "1.1.0",
  "source": {
    "agent": "oods-forge-synthetic",
    "stage": "compose",
    "captured_at": "2026-05-16T00:00:00.000Z",
    "oods_catalog_version": "1.0.0"
  },
  "entities": [
    {
      "urn": "urn:proto:semantic:subscription-summary-row-lowconf@1.0.0",
      "element": {
        "type": "ui.surface.row",
        "name": "Subscription summary row (low confidence)"
      },
      "semantics": {
        "purpose": "summarize subscription",
        "human_meaning": "Synthetic low-confidence variant of the subscription summary row. Used by C3 review/recovery tests to exercise the REVIEW NEEDED path; production fixtures are high-confidence by construction and never trip the below-threshold branch.",
        "tags": ["billing", "subscription", "synthetic"],
        "keywords": ["subscription", "renews", "billing"]
      },
      "pragmatic_role": "informational",
      "states": ["active", "paused", "cancelled"],
      "preconditions": ["subscription.exists"],
      "effects": [],
      "traits": ["Identifiable", "Datable"],
      "context": { "domain": "billing", "surface": "desktop" },
      "locations": [
        { "type": "code", "path": "components/billing/SubscriptionSummaryRow.tsx" }
      ],
      "evidence_refs": [
        {
          "id": "ev_subscription_lowconf_001",
          "protocol": "pragmatic",
          "kind": "manifest_declaration",
          "locator": "self",
          "matched": null,
          "weight": 0.4,
          "provenance": "declared",
          "captured_at": "2026-05-16T00:00:00.000Z"
        }
      ],
      "relationships": {
        "edges": [
          {
            "type": "renews_to",
            "from": "urn:proto:semantic:subscription-summary-row-lowconf@1.0.0",
            "to": "urn:proto:semantic:subscription-renewal-confirmation@1.0.0",
            "direction": "out",
            "provenance": "declared",
            "weight": 0.4
          }
        ]
      },
      "oods": {
        "catalog": { "version": "1.0.0" },
        "render": {
          "ui_schema_ref": "compose-subscription-summary",
          "slots": [
            { "name": "title", "binding": { "field": "subscription.plan_name" } },
            { "name": "subtitle", "binding": { "field": "subscription.renews_at" } },
            { "name": "status", "binding": { "field": "subscription.state" } }
          ],
          "brand_overlay": "brand-a"
        },
        "confidence_decomposition": {
          "total": 0.4,
          "signals": [
            {
              "name": "trait_membership",
              "score": 0.32,
              "hint": "Identifiable: weak match; Datable: ambiguous (renews_at could be timestamp or relative)"
            },
            {
              "name": "evidence_chain",
              "score": 0.41,
              "hint": "Stage1 declared-only fallback; no run_id recovered"
            },
            {
              "name": "field_binding_coverage",
              "score": 0.48,
              "hint": "status slot binds to subscription.state but production data emits subscription.lifecycle_state"
            },
            {
              "name": "semantic_purpose_match",
              "score": 0.55,
              "hint": "purpose='summarize subscription' is acceptable; human_meaning is generic"
            }
          ]
        }
      }
    }
  ]
}
